연번,회사명,공장대표주소,업종
1812,엠투상사,"인천광역시 부평구 부평대로 301 6층 612호 (청천동, 남광센트렉스) 6층 612호",신발 부분품 제조업
1813,엠피(MP)소노텍,"인천광역시 부평구 부평대로 301 2층 207호 (청천동, 남광센트렉스) 2층 207호",전자 응용 절삭기계 제조업
1814,엠피소닉,"인천광역시 부평구 부평대로 301 3층 307호 (청천동, 남광센트렉스) 3층 307호",그 외 기타 일반목적용 기계 제조업 외 1 종
1815,엠피소닉,"인천광역시 부평구 부평대로 283, (청천동, 부평 우림라이온스밸리) B동 6층 602호",비주거용 건물 임대업
1816,엠피엔지니어링,"인천광역시 부평구 부평대로 301 5층 513호 (청천동, 남광센트렉스) 5층 513호",비주거용 건물 임대업
1817,엠피엔지니어링,"인천광역시 부평구 부평대로 337, 2층 235호(청천동, 부평 제이타워3차 지식산업센터) 2층 235호 외 4필지",비주거용 건물 임대업
1818,연우시스템,"인천광역시 부평구 부평대로 337, 12층 1243호(청천동, 부평 제이타워3차 지식산업센터) 12층 1243호",기기용 자동측정 및 제어장치 제조업
1819,연우시스템,"인천광역시 부평구 백범로577번길 20, (십정동, 경인센타) 공장동 4층 432호",배전반 및 전기 자동제어반 제조업
1820,영광제화,"인천광역시 부평구 부평북로 58, 303호(청천동)",기타 신발 제조업 외 1 종
1821,영동식품,인천광역시 부평구 세월천로 216-11 (청천동),떡류 제조업
1822,영동정밀,"인천광역시 부평구 부평대로 337, 3층 313호 (청천동, 부평 제이타워3차 지식산업센터) 3층 313호",절삭가공 및 유사처리업
1823,영동정밀,인천광역시 부평구 청천2동 7-20번지,주형 및 금형 제조업
1824,영동포장,인천광역시 부평구 새벌로 44 (청천동),"플라스틱 포대, 봉투 및 유사제품 제조업"
1825,영림,"인천광역시 부평구 새벌로 29 2층 211호 (청천동, 부평테크노타워) 2층 211호",기타 편조의복 액세서리 제조업
1826,영상문화,"인천광역시 부평구 부평대로 337, 8층 812호(청천동, 부평 제이타워3차 지식산업센터) 8층 812호 외 3필지",기타 광학기기 및 사진기 제조업
1827,영원,"인천광역시 부평구 경인로1046번길 7, 2층 2호 (부개동)",셔츠 및 블라우스 제조업 외 4 종
1828,영전자,"인천광역시 부평구 부평대로 337, 10층 1024호(청천동, 부평 제이타워3차 지식산업센터) 10층 1024호",그 외 기타 전자부품 제조업
1829,영지산업(주),인천광역시 부평구 세월천로 5-1 (청천동),기타 가정용 전기기기 제조업 외 9 종
1830,영진,인천광역시 부평구 마장로180번길 1 (산곡동),전동기 및 발전기 제조업
1831,영진상사,"인천광역시 부평구 충선로 8, 302, 303, 304호(부평동, 대흥프라자)","근무복, 작업복 및 유사의복 제조업 외 2 종"
1832,영테크,"인천광역시 부평구 부평대로 301, 2층 217-2호(청천동, 남광센트렉스) 2층 217-2호",기타 기계.장비 조립용 플라스틱 제품 제조업
1833,영프로세스,"인천광역시 부평구 평천로255번길 13, 9층 903호 (청천동) 9층 903호",기타 인쇄물 출판업
1834,영화실업,"인천광역시 부평구 부평대로 283, C동 9층 903 (청천동, 부평 우림라이온스밸리)",모조 귀금속 및 모조 장신용품 제조업
1835,예니주얼리,"인천광역시 부평구 평천로199번길 53, B동 2층 (청천동)",귀금속 및 관련제품 제조업
1836,예서,"인천광역시 부평구 부평대로 301, 5층 507호 (청천동, 남광센트렉스) 5층 507호",비주거용 건물 임대업
1837,예성슈테크,"인천광역시 부평구 부평대로 283, (청천동, 부평우림라이온스밸리) B동 5층 503-B호",비주거용 건물 임대업
1838,예성슈테크,"인천광역시 부평구 부평대로 337, 5층 551호(청천동, 부평 제이타워3차 지식산업센터) 5층 551호",신발 부분품 제조업
1839,예솔이앤에스 주식회사,"인천광역시 부평구 부평대로 301 8층 815호 (청천동, 남광센트렉스) 8층 815호",시스템 소프트웨어 개발 및 공급업
1840,예스블라인드,"인천광역시 부평구 부평대로 337, 6층 631호 (청천동, 부평 제이타워3차 지식산업센터) 6층 631호",커튼 및 유사제품 제조업
1841,예스테크,"인천광역시 부평구 백범로577번길 20, 공장동동 3층 321호 (십정동, 경인센타) 공장동 3층 321호",인쇄회로기판용 적층판 제조업 외 2 종
1842,예은기전,"인천광역시 부평구 부평대로 337, 10층 1042호 (청천동, 부평 제이타워3차 지식산업센터) 10층 1042호",배전반 및 전기 자동제어반 제조업
1843,예진실업,"인천광역시 부평구 새벌로 29, 4층 409호 (청천동, 부평테크노타워) 4층 409호",포장 및 충전업
1844,예현정밀,"인천광역시 부평구 평천로199번길 53, 418-3 (청천동)",주형 및 금형 제조업
1845,오늘은,"인천광역시 부평구 부평대로 337, 11층 1102호 (청천동, 부평 제이타워3차 지식산업센터) 11층 1102호",그 외 기타 플라스틱 제품 제조업
1846,오드디자인,"인천광역시 부평구 부평대로 283, C동 B1층 B127 (청천동, 부평 우림라이온스밸리)",기타 목재가구 제조업
1847,오드디자인,"인천광역시 부평구 부평대로 283, C동 B1층 B128 (청천동, 부평 우림라이온스밸리)",기타 목재가구 제조업
1848,오랄픽(oralpik),"인천광역시 부평구 평천로255번길 13, 10층 1001호(청천동) 10층 1001호",비주거용 건물 임대업
1849,오리시스이앤씨(주),"인천광역시 부평구 주부토로 236,(갈산동) 제비동 2층 208호",배전반 및 전기 자동제어반 제조업
1850,오리진,"인천광역시 부평구 부평대로 301 3층 309호 (청천동, 남광센트렉스) 3층 309호",산업처리공정 제어장비 제조업
1851,오방,"인천광역시 부평구 부평대로 283, A동 4층 403호 (청천동, 부평 우림라이온스밸리)",기타 악기 및 전자 악기 제조업
1852,오버라이트이엔지,"인천광역시 부평구 부평대로 337, 6층 617호(청천동, 부평 제이타워3차 지식산업센터) 6층 617호",배전반 및 전기 자동제어반 제조업
1853,오병이어 주식회사,"인천광역시 부평구 부평대로297번길 28, 1층 (청천동) 외 1필지",그 외 기타 플라스틱 제품 제조업
1854,오성이앤지,"인천광역시 부평구 부평대로 337, 3층 309호(청천동, 부평 제이타워3차 지식산업센터) 3층 309호",그 외 기타 금속가공업
1855,오성텍,인천광역시 부평구 가재울로 165(십정동),운송장비 조립용 플라스틱제품 제조업 외 1 종
1856,오션21(OCEAN21),"인천광역시 부평구 무네미로448번길 56, 산학협력관별관B102호 (구산동, 폴리텍Ⅱ대학)",액체 여과기 제조업
1857,오존엔지니어링(주),인천광역시 부평구 부평대로329번길 3 (청천동),전기경보 및 신호장치 제조업 외 2 종
1858,오케이스카시,인천광역시 부평구 수변로 103 (부개동),간판 및 광고물 제조업 외 9 종
1859,오토나서울,"인천광역시 부평구 부평대로 293, 10층 1023호 (청천동, 부평테크시티) 10층 1023호",애니메이션 영화 및 비디오물 제작업
1860,오토서브,"인천광역시 부평구 부평대로 283, C동 B2층 B218 (청천동, 부평 우림라이온스밸리)",모터사이클 제조업 외 1 종
1861,오토서브 제2공장,"인천광역시 부평구 부평대로 283, (청천동, 부평우림라이온스밸리) C동 B1층 B119호",수동식 식품 가공기기 및 금속 주방용기 제조업
1862,오토스마텍,"인천광역시 부평구 부평대로 337, 4층 427호 (청천동, 부평 제이타워3차 지식산업센터) 4층 427호",환경 관련 엔지니어링 서비스업 외 1 종
1863,오토에프에이,"인천광역시 부평구 부평대로 337, 6층 643호 (청천동, 부평 제이타워3차 지식산업센터) 6층 643호",산업용 로봇 제조업
1864,오투에스,"인천광역시 부평구 부평대로 283, (청천동, 부평우림라이온스밸리) C동 B1층 B121호",그 외 기타 분류 안된 화학제품 제조업 외 1 종
1865,오프리쉬,"인천광역시 부평구 부평대로 337, 11층 1119호(청천동, 부평 제이타워3차 지식산업센터) 11층 1119호",일반 영화 및 비디오물 제작업
1866,온파크 주식회사,"인천광역시 부평구 주부토로 236, C동 706호 (갈산동, 인천테크노밸리 U1센터) C동 706호",기타 주변기기 제조업
1867,올리버출판사,"인천광역시 부평구 부평대로 337, 6층 642호 (청천동, 부평 제이타워3차 지식산업센터) 6층 642호",문구용 종이제품 제조업
1868,올필터,"인천광역시 부평구 부평대로 337, 12층 1222호 (청천동, 부평 제이타워3차 지식산업센터) 12층 1222호",시스템 소프트웨어 개발 및 공급업 외 1 종
1869,옵토제이,"인천광역시 부평구 부평북로236번길 49, 2층 (청천동)",발광 다이오드 제조업
1870,옵티컬랩,"인천광역시 부평구 평천로255번길 13, 3층 302호(청천동) 3층 302호",광섬유 케이블 제조업 외 1 종
1871,와우테크,인천광역시 부평구 부평북로 87 (청천동),금속 캔 및 기타 포장용기 제조업
1872,와이구조,"인천광역시 부평구 부평대로 301 5층 501호 (청천동, 남광센트렉스) 5층 501호",건축설계 및 관련 서비스업
1873,와이비테크코리아 ,"인천광역시 부평구 평천로53번길 24, 3층 (청천동)",포장용 플라스틱 성형용기 제조업
1874,와이에스,"인천광역시 부평구 새벌로 45, 415-2 (청천동)",그 외 기타 전자부품 제조업 외 1 종
1875,와이에이씨카터(주)한국지점,"인천광역시 부평구 부평대로329번길 3, 306호 (청천동)",사무용 기계 및 장비 제조업
1876,와이엠글로벌,"인천광역시 부평구 부평대로 337, 10층 1004호(일부) (청천동, 부평 제이타워3차 지식산업센터) 10층 1004호",광고 대행업
1877,와이제이전자,"인천광역시 부평구 부평대로 283, C동 11층 1106 (청천동, 부평 우림라이온스밸리)",발광 다이오드 제조업 외 1 종
1878,와이제이컴퍼니,"인천광역시 부평구 부평대로 283, (청천동, 부평우림라이온스밸리) A동 5층 511호 외 1필지",광고 대행업
1879,요기다닷컴,"인천광역시 부평구 부평대로 301 3층 319호 (청천동, 남광센트렉스) 3층 319호",일반 영화 및 비디오물 제작업
1880,요리와 주식회사,"인천광역시 부평구 주부토로 236,(갈산동, 인천테크노밸리 U1센터) 제씨동 9층 912호",경 인쇄업
1881,요이준비땅,"인천광역시 부평구 부평대로 337, 4층 415호 (청천동, 부평 제이타워3차 지식산업센터) 4층 415호 외 1필지",그 외 기타 의복액세서리 제조업
1882,우경MIT,인천광역시 부평구 새벌로 12 (청천동),그 외 자동차용 신품 부품 제조업 외 3 종
1883,우금테크,"인천광역시 부평구 부평대로 283, (청천동, 부평우림라이온스밸리) B동 B2층 B230호",주형 및 금형 제조업
1884,우리산업,"인천광역시 부평구 부평대로 283, (청천동, 부평우림라이온스밸리) B동 B1층 B107-C호",그 외 기타 전자부품 제조업 외 1 종
1885,우리식품,인천광역시 부평구 장제로101번길 8 (부평동),장류 제조업
1886,우리유통,"인천광역시 부평구 부평대로 337, 3층 305호 (청천동, 부평 제이타워3차 지식산업센터) 3층 305호",포장 및 충전업
1887,우리인테리어,"인천광역시 부평구 부평대로 283,(청천동, 부평우림라이온스밸리) B동 B2층 B204호",인테리어 디자인업
1888,우리정밀,인천광역시 부평구 평천로199번길 34 (청천동),절삭가공 및 유사처리업 외 1 종
1889,우리테크,"인천광역시 부평구 부평대로 283, (청천동, 부평우림라이온스밸리) B동 3층 307호",비주거용 건물 임대업
1890,우리테크,"인천광역시 부평구 평천로199번길 53, A동 2,3층 (청천동)",기타 가정용 전기기기 제조업 외 1 종
1891,우리테크노,"인천광역시 부평구 부평대로 293, 1층 B113호 (청천동, 부평테크시티) 1층 B113호",전기회로 접속장치 제조업
1892,우리펌프,"인천광역시 부평구 새벌로 29, 6층 605호(청천동) 6층 605호",액체 펌프 제조업
1893,우리해양(주),"인천광역시 부평구 부평대로 283, (청천동, 부평우림라이온스밸리) B동 B2층 B231호",비주거용 건물 임대업
1894,우림산업,"인천광역시 부평구 부평대로 283, (청천동, 부평우림라이온스밸리) B동 B1층 B101호 외 1필지",기타 절연선 및 케이블 제조업
1895,우림산업,인천광역시 부평구 청천2동 45번지 우림라이온스밸리 B동 406호,그 외 자동차용 신품 부품 제조업 외 3 종
1896,우림시스템,"인천광역시 부평구 부평대로 283,(청천동, 부평우림라이온스밸리) B동 3층 302호 외 1필지",비주거용 건물 임대업
1897,우림큐,"인천광역시 부평구 부평대로329번길 59, 2층 (청천동)",기타 운동 및 경기용구 제조업
1898,우림테크,"인천광역시 부평구 부평대로 283, (청천동, 부평우림라이온스밸리) C동 B2층 B205호",주형 및 금형 제조업
1899,우석엔지니어링,"인천광역시 부평구 부평대로 283, (청천동, 부평우림라이온스밸리) B동 B1층 B113호",주형 및 금형 제조업
1900,우성CNC,인천광역시 부평구 새벌로 45 (청천동),인쇄회로기판용 적층판 제조업 외 2 종
1901,우성산업,인천광역시 부평구 주부토로220번길 37 (갈산동),금속 스프링 제조업
1902,우성산전,"인천광역시 부평구 부평대로 337, 5층 519호 (청천동, 부평 제이타워3차 지식산업센터) 5층 519호",배전반 및 전기 자동제어반 제조업
1903,우성스텐코리아(주),인천광역시 부평구 청농로64번길 18 (청천동),"탭, 밸브 및 유사장치 제조업"
1904,우승하이테크,"인천광역시 부평구 부평대로 301, 2층 219호 (청천동, 남광센트렉스) 2층 219호 외 2필지",운송장비 조립용 플라스틱제품 제조업 외 1 종
1905,우영실업,인천광역시 부평구 부평대로329번길 33 (청천동),비주거용 건물 임대업
1906,우인인터내셔널,"인천광역시 부평구 부평대로 283, (청천동, 부평우림라이온스밸리) B동 B2층 B225호",포장 및 충전업
1907,우인인터내셔널,인천광역시 부평구 평천로255번길 13 6층 606호  (청천동) 6층 606호,포장 및 충전업
1908,우일무역(주),"인천광역시 부평구 경인로 1109-1, 지층 (일신동)",침구 및 관련제품 제조업 외 16 종
1909,우정정보통신(주),"인천광역시 부평구 부평대로 301, 3층 308-1호 (청천동, 남광센트렉스) 3층 308-1호",방송장비 제조업 외 1 종
1910,우주물산,"인천광역시 부평구 부평북로 231, 3층 (청천동)",남자용 겉옷 제조업 외 7 종
1911,우주산업,"인천광역시 부평구 부평대로 301 5층 522호 (청천동, 남광센트렉스) 5층 522호",유선 통신장비 제조업
1912,우주전자,"인천광역시 부평구 새벌로 29 4층 401호 (청천동, 부평테크노타워) 4층 401호",전기회로 접속장치 제조업
1913,우진,인천광역시 부평구 백범로 597 (십정동),가정용 및 산업용 공기 조화장치 제조업 외 1 종
1914,우진산업개발,"인천광역시 부평구 부평대로 301, 3층 320호 (청천동, 남광센트렉스) 3층 320호",비주거용 건물 임대업
1915,우진정공,"인천광역시 부평구 부평대로 337, 7층 715호 (청천동, 부평 제이타워3차 지식산업센터) 7층 715호",절삭가공 및 유사처리업
1916,우진정보피씨,"인천광역시 부평구 부평대로 337, 5층 512호(청천동, 부평 제이타워3차 지식산업센터) 5층 512호",컴퓨터 제조업 외 1 종
1917,우진컨설팅,"인천광역시 부평구 부평대로 337, 10층 1032호(청천동, 부평 제이타워3차 지식산업센터) 10층 1032호",비주거용 건물 임대업
1918,우향정밀,"인천광역시 부평구 부평대로 337, 8층 804호(청천동, 부평 제이타워3차 지식산업센터) 8층 804호",비주거용 건물 임대업
1919,움찬,"인천광역시 부평구 부평대로 337, 2층 224호 (청천동, 부평 제이타워3차 지식산업센터) 2층 224호",주방용 및 음식점용 목재가구 제조업
1920,웅지정밀,"인천광역시 부평구 평천로199번길 53, 418-3 (청천동)",주형 및 금형 제조업
1921,웅진테크,인천광역시 부평구 새벌로 29 (청천동) 4층 411호,전구 및 램프 제조업
1922,원강 인더스트리,인천광역시 부평구 부평대로313번길 84 (청천동) 2층 2호,가방 및 기타 보호용 케이스 제조업 외 14 종
1923,원강산업,"인천광역시 부평구 부평대로 301 3층 312호 (청천동, 남광센트렉스) 3층 312호",기타 직물제품 제조업
1924,원광특수고무,인천광역시 부평구 동수로 143 (부개동),고무패킹류 제조업 외 1 종
1925,원솔루션,"인천광역시 부평구 부평대로 337, 4층 411호 (청천동, 부평 제이타워3차 지식산업센터) 4층 411호",그 외 기타 전자부품 제조업
1926,원스릴,"인천광역시 부평구 일신로 65, 2층 (일신동)","탭, 밸브 및 유사장치 제조업"
1927,원실리콘,인천광역시 부평구 백범로577번길 21 (십정동),기타 절연선 및 케이블 제조업 외 1 종
1928,원영기업,"인천광역시 부평구 부평대로 301, B1층 B116-2호 (청천동, 남광센트렉스) B1층 B116-2호",비동력식 수공구 제조업
1929,원우정공,"인천광역시 부평구 부평대로 283, (청천동, 부평우림라이온스밸리) C동 B1층 B103호",그 외 기타 일반목적용 기계 제조업 외 1 종
1930,원진엔지니어링,인천광역시 부평구 장제로 423 (갈산동),금속 주조 및 기타 야금용 기계 제조업
1931,원창인젝트엠(주),인천광역시 부평구 안남로434번길 22 (청천동),주형 및 금형 제조업 외 1 종
1932,월드마그넷트,"인천광역시 부평구 부평대로 337, 6층 602호(청천동, 부평 제이타워3차 지식산업센터) 6층 602호",그 외 기타 플라스틱 제품 제조업
1933,월드방송아이티브이 인천방송,"인천광역시 부평구 부평대로 283, (청천동, 부평우림라이온스밸리) C동 2층 201호",방송 프로그램 제작업
1934,월드벨멜라민,"인천광역시 부평구 부평대로 337, 2층 240호 (청천동, 부평 제이타워3차 지식산업센터) 2층 240호",포장 및 충전업
1935,월드와이어컷팅,"인천광역시 부평구 평천로199번길 34, 1층 A-4호실 (청천동)",절삭가공 및 유사처리업 외 1 종
1936,월드와이어컷팅,"인천광역시 부평구 부평대로 337, 3층 314호(청천동, 부평 제이타워3차 지식산업센터) 3층 314호",주형 및 금형 제조업
1937,월드천막,"인천광역시 부평구 가재울로 129, 2동 103호 (십정동, 테크노1공장)","천막, 텐트 및 유사 제품 제조업"
1938,웰메이드,"인천광역시 부평구 부평대로 301 4층 419호 (청천동, 남광센트렉스) 4층 419호",컴퓨터 제조업
1939,웰스홈(주),인천광역시 부평구 안남로 408 (청천동) 4층,가정용 및 산업용 공기 조화장치 제조업 외 3 종
1940,웰시컴퍼니,"인천광역시 부평구 부평대로 283, (청천동, 부평우림라이온스밸리) A동 4층 409호",콜센터 및 텔레마케팅 서비스업
1941,위너솔루션,"인천광역시 부평구 부평대로 337, 11층 1131호 (청천동, 부평 제이타워3차 지식산업센터) 11층 1131호",배전반 및 전기 자동제어반 제조업
1942,위드앤 어페럴,인천광역시 부평구 부평대로329번길 86 (청천동),유아용 의복 제조업
1943,위드앤 주식회사,인천광역시 부평구 부평대로329번길 86 (청천동),침구 및 관련제품 제조업
1944,윈드스카프,"인천광역시 부평구 부평대로 283, C동 9층 910호 (청천동, 부평 우림라이온스밸리)","근무복, 작업복 및 유사의복 제조업"
1945,윈윈인터내셔날,"인천광역시 부평구 부평대로 337, 3층 327호(청천동, 부평 제이타워3차 지식산업센터) 3층 327호 외 1필지",비주거용 건물 임대업
1946,유니온공조시스템,"인천광역시 부평구 부평대로 283, (청천동, 부평우림라이온스밸리) C동 2층 205호 외 2필지",가정용 및 산업용 공기 조화장치 제조업 외 1 종
1947,유니온공조시스템,"인천광역시 부평구 부평대로 283, (청천동, 부평우림라이온스밸리) C동 B2층 B206호",가정용 및 산업용 공기 조화장치 제조업 외 1 종
1948,유니온이씨티,"인천광역시 부평구 부평대로 283, (청천동, 부평 우림라이온스밸리) C동 9층 901호",비주거용 건물 임대업
1949,유니콤,"인천광역시 부평구 부평대로 337, 5층 541호 (청천동, 부평 제이타워3차 지식산업센터) 5층 541호",배전반 및 전기 자동제어반 제조업
1950,유니크,"인천광역시 부평구 부평대로 283, (청천동, 부평우림라이온스밸리) B동 7층 703-B호",비주거용 건물 임대업
1951,유니크,"인천광역시 부평구 부평대로 337, 12층 1214호 (청천동, 부평 제이타워3차 지식산업센터) 12층 1214호",비주거용 건물 임대업
1952,유니텍코퍼레이션,"인천광역시 부평구 부평대로 301 6층 606호 (청천동, 남광센트렉스) 6층 606호",기타 조명장치 제조업
1953,유니텍코퍼레이션,"인천광역시 부평구 부평대로 337, 7층 749호 (청천동, 부평 제이타워3차 지식산업센터) 7층 749호",기타 조명장치 제조업
1954,유니트전자(주),"인천광역시 부평구 부평대로 337, 7층 703호 (청천동, 부평 제이타워3차 지식산업센터) 7층 703호",그 외 기타 전자부품 제조업
1955,유림레포츠,"인천광역시 부평구 새벌로 15, 3층(청천동)",기타 인쇄업
1956,유민상사,인천광역시 부평구 새벌로 45 (청천동),기타 운동 및 경기용구 제조업
1957,유비텍,인천광역시 부평구 안남로402번길 80 (청천동),플라스틱 필름 제조업 외 1 종
1958,유비텍임대,"인천광역시 부평구 백범로577번길 20, (십정동, 경인센타) 공장동 4층 416호",비주거용 건물 임대업
1959,유사나테크,"인천광역시 부평구 부평대로 283, (청천동, 부평우림라이온스밸리) B동 5층 507호",비주거용 건물 임대업
1960,유성전자,"인천광역시 부평구 부평대로 301 2층 211호 (청천동, 남광센트렉스) 2층 211호",운송장비 조립용 플라스틱제품 제조업 외 1 종
1961,유성테크,인천광역시 부평구 평천로199번길 34 (청천동),전동기 및 발전기 제조업
1962,유앤아이한국마스크,인천광역시 부평구 부평대로329번길 26 (청천동) 1층,기타 직물제품 제조업
1963,유영상사,"인천광역시 부평구 부평대로 337, 1층 107호 (청천동, 부평 제이타워3차 지식산업센터) 1층 107호 외 1필지",포장 및 충전업
1964,유영테크,"인천광역시 부평구 부평대로 301 3층 316호 (청천동, 남광센트렉스) 3층 316호",도장 및 기타 피막처리업
1965,유일시스템,"인천광역시 부평구 부평대로 301 4층 408-1호 (청천동, 남광센트렉스) 4층 408-1호",그 외 기타 전자부품 제조업
1966,유일엔지니어링(주),"인천광역시 부평구 부평대로 283, (청천동, 부평우림라이온스밸리) C동 1층 104호",배전반 및 전기 자동제어반 제조업 외 3 종
1967,유진웰딩,"인천광역시 부평구 평천로305번길 4, 35 (갈산동)",그 외 기타 전기장비 제조업
1968,유진웰딩,"인천광역시 부평구 부평대로 337, 9층 924호(청천동, 부평 제이타워3차 지식산업센터) 9층 924호 외 2필지",그 외 기타 전기장비 제조업
1969,유진이엔지,인천광역시 부평구 가좌로96번길 67 (십정동),그 외 자동차용 신품 부품 제조업 외 3 종
1970,유진전자,"인천광역시 부평구 청천마차로 20, 2층 (청천동)",시계 및 시계부품 제조업
1971,유진하이테크,"인천광역시 부평구 부평대로 337, 5층 540호(청천동, 부평 제이타워3차 지식산업센터) 5층 540호",그 외 기타 금속가공업
1972,유체기술(주),"인천광역시 부평구 부평대로 301 9층 912호 (청천동, 남광센트렉스) 9층 912호",속도계 및 적산계기 제조업 외 1 종
1973,유캐슬가구,"인천광역시 부평구 부평대로 301, 7층 718-2호 (청천동, 남광센트렉스) 7층 718-2호",그 외 기타 가구 제조업 외 1 종
1974,유콘(주),"인천광역시 부평구 부평대로 293, 10층 1021호 (청천동, 부평테크시티) 10층 1021호",광고 대행업 외 1 종
1975,유팩,"인천광역시 부평구 부평대로 337, 4층 438호(청천동, 부평 제이타워3차 지식산업센터) 4층 438호 외 1필지","용기 세척, 포장 및 충전기 제조업"
1976,유한,"인천광역시 부평구 부평대로 283, (청천동, 부평우림라이온스밸리) C동 8층 809-B호",그 외 기타 전자부품 제조업 외 1 종
