연번,회사명,공장대표주소,업종
661,(주)이엔지,인천광역시 부평구 청천마차로 18 (청천동),금속 가구 제조업 외 4 종
662,(주)이엘에스,"인천광역시 부평구 부평대로 301 7층 715호 (청천동, 남광센트렉스) 7층 715호",일반용 전기 조명장치 제조업 외 6 종
663,(주)이엠,"인천광역시 부평구 부평대로 301 9층 921호 (청천동, 남광센트렉스) 9층 921호",기억장치 제조업
664,(주)이온팜스,"인천광역시 부평구 부평대로 301 9층 908호 (청천동, 남광센트렉스) 9층 908호",체외 진단 시약 제조업 외 2 종
665,(주)이음,"인천광역시 부평구 부평북로236번길 49, 1층 (청천동)",알루미늄주물 주조업 외 3 종
666,(주)이음에스피,"인천광역시 부평구 부평대로 293, 8층 816호 (청천동, 부평테크시티) 8층 816호",제품 디자인업
667,(주)이지테크,"인천광역시 부평구 백범로 585,[십정동 563-16] (십정동)",금속 절삭기계 제조업
668,(주)이지팜,"인천광역시 부평구 부평대로 301 7층 718-1호 (청천동, 남광센트렉스) 7층 718-1호",남자용 겉옷 제조업
669,(주)이테크,"인천광역시 부평구 부평대로297번길 28, 1층 일부  (청천동)",기타 가정용 전기기기 제조업
670,(주)이포파트너스,"인천광역시 부평구 부평대로 337, 6층 615호(청천동, 부평 제이타워3차 지식산업센터) 6층 615호",그 외 기타 분류 안된 금속 가공 제품 제조업
671,(주)이프린트존,"인천광역시 부평구 부평대로 301, 5층 508-1호 (청천동, 남광센트렉스) 5층 508-1호",스크린 인쇄업
672,(주)이피아이티,"인천광역시 부평구 부평대로 283, (청천동, 부평우림라이온스밸리) C동 5층 503-A호 외 3필지",기체 여과기 제조업
673,(주)이피아이티,인천광역시 부평구 안남로402번길 76 (청천동) (주)이피아이티,기체 여과기 제조업 외 2 종
674,(주)이한테크,"인천광역시 부평구 가재울로 137, 2동 101호, 103호 (십정동)",주형 및 금형 제조업 외 1 종
675,(주)이형산업,"인천광역시 부평구 평천로199번길 34, 1층(청천동)","탭, 밸브 및 유사장치 제조업"
676,(주)이형산업,인천광역시 부평구 안남로434번길 70(청천동),"탭, 밸브 및 유사장치 제조업"
677,(주)인나,"인천광역시 부평구 부평대로 337, 8층 844호 (청천동, 부평 제이타워3차 지식산업센터) 8층 844호",산업처리공정 제어장비 제조업
678,(주)인덱스에프앤씨,인천광역시 부평구 부평대로329번길 33 (청천동),기타 직물제품 제조업
679,(주)인산씨앤씨,인천광역시 부평구 부평대로329번길 42 (청천동),기타 구조용 금속제품 제조업 외 5 종
680,(주)인스코비,"인천광역시 부평구 안남로402번길 11, 3층 (청천동)",속도계 및 적산계기 제조업 외 1 종
681,(주)인찬,인천광역시 부평구 세월천로 5-1 (청천동),육상 금속 골조 구조재 제조업 외 6 종
682,(주)인찬,"인천광역시 부평구 부평대로 283, (청천동, 부평우림라이온스밸리) C동 6층 609-B호 외 1필지",방송장비 제조업 외 7 종
683,(주)인찬,"인천광역시 부평구 부평대로 283,(청천동, 부평우림라이온스밸리) B동 B2층 B215호 외 1필지",방송장비 제조업 외 5 종
684,(주)인켈,인천광역시 부평구 청중로 93 (청천동),텔레비전 제조업 외 12 종
685,(주)인코스,인천광역시 부평구 청중로 92 (청천동),화장품 제조업
686,(주)인트루,"인천광역시 부평구 새벌로 28, 3층(청천동)",그 외 기타 플라스틱 제품 제조업
687,(주)일간경기,"인천광역시 부평구 부평대로 337, 11층 1147호 (청천동, 부평 제이타워3차 지식산업센터) 11층 1147호",신문 발행업
688,(주)일렉켐,인천광역시 부평구 평천로115번길 37 (청천동),그 외 기타 전자부품 제조업 외 1 종
689,(주)일성전자,"인천광역시 부평구 부평대로297번길 96, 3층, 5층(청천동)",그 외 기타 전기장비 제조업
690,(주)자임,"인천광역시 부평구 부평대로 301, 9층 913호(청천동, 남광센트렉스) 9층 913호",기타 무선 통신장비 제조업
691,(주)장한이엠씨,"인천광역시 부평구 무네미로448번길 103, 323호 (구산동)",그 외 기타 달리 분류되지 않은 운송장비 제조업 외 1 종
692,(주)정광피에스아이,인천광역시 부평구 부평대로329번길 59 (청천동),주형 및 금형 제조업 외 1 종
693,(주)정성정밀,"인천광역시 부평구 부평북로 146, (주)정성정밀 (청천동)",주형 및 금형 제조업
694,(주)정안,"인천광역시 부평구 부평대로 337, 2층 205호 (청천동, 부평 제이타워3차 지식산업센터) 2층 205호",비주거용 건물 임대업
695,(주)정우디스플레이,인천광역시 부평구 부평북로178번길 2 (청천동),플라스틱 접착처리 제품 제조업 외 3 종
696,(주)정우디스플레이,인천광역시 부평구 부평대로329번길 49 (청천동),플라스틱 접착처리 제품 제조업 외 3 종
697,(주)정우디스플레이,인천광역시 부평구 부평대로297번길 79(청천동),비주거용 건물 임대업
698,(주)정우디스플레이,인천광역시 부평구 부평북로 53 (청천동),플라스틱 접착처리 제품 제조업 외 2 종
699,(주)정우브레카,인천광역시 부평구 안남로418번길 7 (청천동),유압기기 제조업
700,(주)정우아이엠에스,"인천광역시 부평구 가재울로 129, 1동 103호 (십정동, 테크노1공장)",전시 및 광고용 조명장치 제조업
701,(주)정이노베이션 ,"인천광역시 부평구 부평대로 337, 11층 1120호(청천동, 부평 제이타워3차 지식산업센터) 11층 1120호",그 외 기타 전기장비 제조업 외 2 종
702,(주)정인켐텍,"인천광역시 부평구 부평대로 337, 5층 514호 (청천동, 부평 제이타워3차 지식산업센터) 5층 514호",비주거용 건물 임대업
703,(주)정진멀티테크놀로지,인천광역시 부평구 청천마차로 216 (청천동),기타 표시장치 제조업 외 9 종
704,(주)정평글로벌,"인천광역시 부평구 부평대로 337, 4층 428호(청천동, 부평 제이타워3차 지식산업센터) 4층 428호",구조용 금속 판제품 및 공작물 제조업
705,(주)제오글로벌,"인천광역시 부평구 부평북로 247, 2층 (청천동)",플라스틱 창호 제조업
706,(주)제오메이드,"인천광역시 부평구 부평북로 247, 3층(청천동)",일반철물 제조업
707,(주)제이더블유,"인천광역시 부평구 부평대로 283, (청천동, 부평우림라이온스밸리) C동 8층 810-B호",광고 대행업
708,(주)제이디플레이아카데미,"인천광역시 부평구 백범로577번길 20, 516호(십정동, 경인센타)",빵류 제조업 외 1 종
709,(주)제이쓰리,"인천광역시 부평구 부평대로 283, (청천동, 부평우림라이온스밸리) B동 2층 203호",배전반 및 전기 자동제어반 제조업
710,(주)제이아이에이치,"인천광역시 부평구 부평대로 283, (청천동, 부평우림라이온스밸리) B동 6층 602호",철도차량 부품 및 관련 장치물 제조업
711,(주)제이아이에프앤씨,"인천광역시 부평구 새벌로 29 7층 701호 (청천동, 부평테크노타워) 7층 701호",침구 및 관련제품 제조업 외 10 종
712,(주)제이앤테크,"인천광역시 부평구 평천로255번길 13, 5층 506호  (청천동) 5층 506호",배전반 및 전기 자동제어반 제조업
713,(주)제이앤피커머스,"인천광역시 부평구 부평대로 337 6층 645호 (청천동, 부평 제이타워3차 지식산업센터) 6층 645호",광고 대행업
714,(주)제이에스솔루션,"인천광역시 부평구 부평대로 337, 9층 916호 (청천동, 부평 제이타워3차 지식산업센터) 9층 916호",방송장비 제조업
715,(주)제이에이치에너지,"인천광역시 부평구 부평대로 283,(청천동) C동 B2층 B227호",전기·전자공학 연구개발업 외 2 종
716,(주)제이에프,"인천광역시 부평구 부평북로 231, 3층(청천동)",화학섬유직물 직조업 외 24 종
717,(주)제이엔케이테크,인천광역시 부평구 안남로402번길 28 (청천동),전자부품 실장기판 제조업
718,(주)제이엘오케이,"인천광역시 부평구 부평대로 337, 12층 1260호 (청천동, 부평 제이타워3차 지식산업센터) 12층 1260호",콜센터 및 텔레마케팅 서비스업
719,(주)제이제이이노텍,"인천광역시 부평구 평천로255번길 13, 10층 1002호(청천동) 10층 1002호",비주거용 건물 임대업
720,(주)제이케이러버,"인천광역시 부평구 구산로 19, 1층, 2층 (구산동)",그 외 기타 고무제품 제조업
721,(주)제이케이앤더블유,"인천광역시 부평구 부평북로 11, 401호(청천동)",그 외 기타 플라스틱 제품 제조업
722,(주)제이케이엔지니어링,"인천광역시 부평구 백범로577번길 20, 535호(십정동, 경인센타) 외 1필지",가정용 및 산업용 공기 조화장치 제조업 외 1 종
723,(주)제이투에스,"인천광역시 부평구 부평대로 337, 12층 1212호 (청천동, 부평 제이타워3차 지식산업센터) 12층 1212호",시스템 소프트웨어 개발 및 공급업
724,(주)제이포,인천광역시 부평구 새벌로 29 2층 214호 (청천동) 부평테크노타워 2층 214호,그 외 기타 플라스틱 제품 제조업
725,(주)제일솔루션,인천광역시 부평구 청천마차로 58 (청천동),기타 가공 공작기계 제조업
726,(주)제일코아,"인천광역시 부평구 서달로298번길 120-8,  외 1필지 (청천동)",판지 상자 및 용기 제조업
727,(주)제일테크,"인천광역시 부평구 백범로577번길 20, 공장동동 5층 537호 (십정동, 경인센타) 공장동 5층 537호",가정용 및 산업용 공기 조화장치 제조업 외 1 종
728,(주)제일트랜스,인천광역시 부평구 청천마차로 218 (청천동),변압기 제조업
729,(주)제일필름,"인천광역시 부평구 부평대로 283, (청천동, 부평우림라이온스밸리) B동 5층 501호",플라스틱 필름 제조업
730,(주)제일하이테크,"인천광역시 부평구 부평북로236번길 49, 3층 303호(청천동)",전자감지장치 제조업
731,(주)제트에프코리아,인천광역시 부평구 평천로 195 (청천동),유압기기 제조업 외 1 종
732,(주)제트엠솔루션,"인천광역시 부평구 부평대로 337, 2층 201호 (청천동, 부평 제이타워3차 지식산업센터) 2층 201호","물질 검사, 측정 및 분석기구 제조업 외 1 종"
733,(주)제팩,"인천광역시 부평구 백범로603번길 9, (십정동 563-11) (십정동)",산업용 로봇 제조업 외 2 종
734,(주)제팩로보틱스,"인천광역시 부평구 백범로603번길 9, 2층 (십정동)","용기 세척, 포장 및 충전기 제조업"
735,(주)조나단씨엔티,"인천광역시 부평구 부평대로 283, A동 1층 102 (청천동, 부평 우림라이온스밸리) A동 1층 102호",산업처리공정 제어장비 제조업 외 5 종
736,(주)조선일보사,인천광역시 부평구 부평대로313번길 14 (청천동),신문 발행업
737,(주)조일기업,인천광역시 부평구 부평대로313번길 73 (청천동),그 외 기타 일반목적용 기계 제조업 외 2 종
738,(주)주노무역,"인천광역시 부평구 부평대로 337, 9층 942호 (청천동, 부평 제이타워3차 지식산업센터) 9층 942호",남자용 겉옷 제조업 외 1 종
739,(주)주연테크,"인천광역시 부평구 안남로418번길 27, B동 102호 (청천동)","고무, 화학섬유 및 플라스틱 성형기 제조업 외 1 종"
740,(주)주원엘리베이터,"인천광역시 부평구 부평대로 283, (청천동, 부평우림라이온스밸리) C동 6층 606호 외 2필지",배전반 및 전기 자동제어반 제조업
741,(주)주원정밀,인천광역시 부평구 청농로44번길 32-2(청천동),금속 성형기계 제조업 외 1 종
742,(주)주형통,"인천광역시 부평구 부평대로 337, 6층 627호(청천동, 부평 제이타워3차 지식산업센터) 6층 627호 외 2필지",그 외 기타 달리 분류되지 않은 제품 제조업 외 1 종
743,(주)준일산업,"인천광역시 부평구 새벌로 29 2층 201호 (청천동, 부평테크노타워) 2층 201호",포장용 플라스틱 성형용기 제조업
744,(주)중앙소방이앤지,"인천광역시 부평구 부평대로 296, 지1층 (갈산동)",배전반 및 전기 자동제어반 제조업
745,(주)중원인더스트리,인천광역시 부평구 부평북로 289 (갈산동),운송장비용 조명장치 제조업
746,(주)중원제이에이치이,"인천광역시 부평구 부평대로 283, (청천동, 부평우림라이온스밸리) C동 4층 401호","증류기, 열교환기 및 가스발생기 제조업"
747,(주)지니리테일,"인천광역시 부평구 부평대로 283,(청천동, 부평우림라이온스밸리) C동 B1층 B133호",경영 컨설팅업
748,(주)지니컴퍼니,"인천광역시 부평구 부평대로 301 7층 715호 (청천동, 남광센트렉스) 7층 715호",광고 대행업
749,(주)지니트,"인천광역시 부평구 부평대로 283, (청천동, 부평우림라이온스밸리) B동 8층 802호 외 1필지",기타 주변기기 제조업 외 6 종
750,(주)지비티코리아,인천광역시 부평구 부평대로329번길 3 (청천동) 2층 204호,기타 직물제품 제조업
751,(주)지솔,"인천광역시 부평구 주부토로 236, C동 1503호(갈산동, 인천테크노밸리 U1센터) C동 1503호",방송장비 제조업 외 3 종
752,(주)지스타바이오,"인천광역시 부평구 주부토로 236,(갈산동) 제디동 6층 607호",생물 살균.살충제 및 식물보호제 제조업
753,(주)지에스공성,"인천광역시 부평구 안남로417번길 17, 1층, 3층 (청천동)",주형 및 금형 제조업
754,(주)지에스아웃소싱,"인천광역시 부평구 부평대로 283,(청천동, 부평우림라이온스밸리) B동 B2층 B217호",사업시설 유지.관리 서비스업
755,(주)지에스유씨씨티브이,"인천광역시 부평구 부평대로 301 8층 803호 (청천동, 남광센트렉스) 8층 803호",방송장비 제조업
756,(주)지에이치드림,"인천광역시 부평구 주부토로 236,(갈산동) 제디동 B1층 110호 외 1필지",주형 및 금형 제조업
757,(주)지에프코리아,인천광역시 부평구 경인로1009번길 15 (부평동),육류 기타 가공 및 저장처리업 (가금류 제외) 외 1 종
758,(주)지엠디,"인천광역시 부평구 부평대로 301, 5층 523호 (청천동, 남광센트렉스) 5층 523호",그 외 기타 의료용 기기 제조업
759,(주)지엠에스,"인천광역시 부평구 부평대로 283, (청천동, 부평우림라이온스밸리) B동 7층 706호",기타 오락용품 제조업 외 2 종
760,(주)지영솔루텍,"인천광역시 부평구 안남로433번길 13, 2층 (청천동)",그 외 기타 의료용 기기 제조업
761,(주)지지에프,인천광역시 부평구 부평북로 212 (청천동),빵류 제조업 외 1 종
762,(주)지지푸드,인천광역시 부평구 청천마차로 204 (청천동),빵류 제조업 외 2 종
763,(주)지킬,"인천광역시 부평구 새벌로 4, 3층 (청천동)",방송장비 제조업
764,(주)지훈산업,"인천광역시 부평구 부평북로 301-1, 3층 (갈산동)",플라스틱 접착처리 제품 제조업 외 1 종
765,(주)진영알엔에치,인천광역시 부평구 부평북로 50 (청천동),산업용 난방보일러 및 방열기 제조업
766,(주)진영전기조명산업,인천광역시 부평구 세월천로30번길 25 (청천동),일반용 전기 조명장치 제조업
767,(주)진영코퍼레이션,"인천광역시 부평구 주부토로 236,(갈산동) 제시동 6층 608호",산업용 로봇 제조업
768,(주)진일부품,인천광역시 부평구 주부토로252번길 15 (갈산동),유선 통신장비 제조업 외 6 종
769,(주)진텍엔지니어링,"인천광역시 부평구 부평대로 337, 8층 813호 (청천동, 부평 제이타워3차 지식산업센터) 8층 813호 외 1필지",기타 엔지니어링 서비스업
770,(주)집쇼코리아,"인천광역시 부평구 부평대로 293, 9층 908호 (청천동, 부평테크시티) 9층 908호",응용 소프트웨어 개발 및 공급업
771,(주)참길,"인천광역시 부평구 안남로369번길 30, 4층 (청천동)",그 외 기타 분류 안된 금속 가공 제품 제조업 외 3 종
772,(주)참솔테크,"인천광역시 부평구 부평대로 283, (청천동, 부평우림라이온스밸리) B동 B1층 B107호 외 1필지",기타 구조용 금속제품 제조업 외 6 종
773,(주)창조인텔,인천광역시 부평구 청농로32번길 10 (청천동),그 외 기타 의료용 기기 제조업
774,(주)창진창호,"인천광역시 부평구 부평대로 337, 8층 809호(청천동, 부평 제이타워3차 지식산업센터) 8층 809호","금속 문, 창, 셔터 및 관련제품 제조업"
775,(주)천일육가공,인천광역시 부평구 영성로 78 (삼산동),육류 기타 가공 및 저장처리업 (가금류 제외) 외 1 종
776,(주)천해무,"인천광역시 부평구 주부토로 236,(갈산동) 제비동 4층 413호 외 2필지",수산동물 건조 및 염장품 제조업
777,(주)청도테크비즈,인천광역시 부평구 청농로 28(청천동),그 외 기타 분류 안된 금속 가공 제품 제조업 외 4 종
778,(주)청송,인천광역시 부평구 길주남로 118-10 (부개동),"플라스틱 포대, 봉투 및 유사제품 제조업 외 1 종"
779,(주)카모스,"인천광역시 부평구 부평대로 283, C동 8층 810호 (청천동, 부평 우림라이온스밸리)",비디오 및 기타 영상기기 제조업
780,(주)카모스,"인천광역시 부평구 안남로402번길 80, 1층, 4층, 5층(청천동)",비디오 및 기타 영상기기 제조업
781,(주)카스하이퍼씨앤씨,"인천광역시 부평구 수변로 99, 지하1층 (부개동)",유선 통신장비 제조업 외 2 종
782,(주)카슬라,"인천광역시 부평구 주부토로 236,(갈산동) 제비동 6층 614호",그 외 기타 플라스틱 제품 제조업
783,(주)캐리어바른시스템,"인천광역시 부평구 부평대로 337, 3층 318호 (청천동, 부평 제이타워3차 지식산업센터) 3층 318호",그 외 기타 분류 안된 금속 가공 제품 제조업 외 1 종
784,(주)컨텍,"인천광역시 부평구 청천마차로 218, 1층 (청천동)",일반용 전기 조명장치 제조업
785,(주)컨텍,"인천광역시 부평구 부평대로 301, 5층 525호 (청천동, 남광센트렉스) 5층 525호",일반용 전기 조명장치 제조업
786,(주)컬러스토리,"인천광역시 부평구 평천로255번길 13, 6층 606호(청천동) 6층 606호",인형 및 장난감 제조업 외 1 종
787,(주)컴위드(COMWID Inc.),"인천광역시 부평구 부평대로 337, 11층 1141호(청천동, 부평 제이타워3차 지식산업센터) 11층 1141호 외 2필지",포장 및 충전업
788,(주)케미텍코리아,"인천광역시 부평구 평천로255번길 13, 5층 509호  (청천동) 5층 509호 외 1필지",플라스틱 접착처리 제품 제조업
789,(주)케어라이브,"인천광역시 부평구 부평대로 337, 8층 801호 (청천동, 부평 제이타워3차 지식산업센터) 8층 801호",시스템 소프트웨어 개발 및 공급업
790,(주)케이로지스틱스,"인천광역시 부평구 부평대로 283, (청천동, 부평우림라이온스밸리) B동 5층 505호",컴퓨터시스템 통합 자문 및 구축 서비스업
791,(주)케이씨네트웍스,"인천광역시 부평구 안남로369번길 34, 3층 (청천동)",기타 무선 통신장비 제조업 외 1 종
792,(주)케이씨엠텍,"인천광역시 부평구 안남로369번길 34, 3층 (청천동)",비디오 및 기타 영상기기 제조업
793,(주)케이씨이,인천광역시 부평구 안남로369번길 34 (청천동),비디오 및 기타 영상기기 제조업 외 1 종
794,(주)케이아이씨텍,"인천광역시 부평구 부평대로 283, C동 8층 803 (청천동, 부평 우림라이온스밸리)",그 외 기타 전자부품 제조업 외 1 종
795,(주)케이알티,"인천광역시 부평구 부평대로 283, (청천동, 부평우림라이온스밸리) C동 B2층 B219호",그 외 기타 일반목적용 기계 제조업 외 1 종
796,(주)케이앤피,"인천광역시 부평구 부평대로 293, 11층 1104호(청천동, 부평테크시티) 11층 1104호",경영 컨설팅업
797,(주)케이에스앤,"인천광역시 부평구 안남로434번길 79, C동 (청천동)",금속선 가공제품 제조업
798,(주)케이에프씨,"인천광역시 부평구 부평대로 283, (청천동, 부평 우림라이온스밸리) C동 3층 306호",비주거용 건물 임대업
799,(주)케이엔디,"인천광역시 부평구 안남로 404, 1~2층(일부) (청천동)",전자저항기 및 전자카드 제조업 외 1 종
800,(주)케이오피,"인천광역시 부평구 부평대로329번길 42 (청천동) 1, 2, 3층",기타 구조용 금속제품 제조업 외 1 종
801,(주)케이원아이엔씨,"인천광역시 부평구 부평대로 283,(청천동, 부평우림라이온스밸리) C동 9층 901호",산업용 로봇 제조업 외 1 종
802,(주)케이제이씨디스플레이코퍼레이션,"인천광역시 부평구 주부토로 236,(갈산동, 인천테크노밸리 U1센터) 씨동 5층 501호 외 1필지",컴퓨터 모니터 제조업 외 2 종
803,(주)케이지비이엔지,"인천광역시 부평구 새벌로 29 2층 209호 (청천동, 부평테크노타워) 2층 209호",포장 및 충전업
804,(주)케이지옵틱스,"인천광역시 부평구 부평대로313번길 84, 416-1 (청천동)",안경 및 안경렌즈 제조업 외 1 종
805,(주)케이지일렉트론,인천광역시 부평구 부평대로329번길 42 (청천동),액체 여과기 제조업 외 1 종
806,(주)케이케이로드웍스,"인천광역시 부평구 서달로298번길 73, 3층 (청천동)",낚시 및 수렵용구 제조업
807,(주)케이피에프이노베이션,"인천광역시 부평구 부평대로 283, (청천동, 부평 우림라이온스밸리) C동 6층 605호",태양력 발전업
808,(주)코넥터,"인천광역시 부평구 부평대로 337, 6층 603호 (청천동, 부평 제이타워3차 지식산업센터) 6층 603호",그 외 기타 전자부품 제조업
809,(주)코리아노바,"인천광역시 부평구 평천로255번길 13, 3층 305호  (청천동) 3층 305호",농업 및 임업용 기계 제조업 외 1 종
810,(주)코리아비티에스,"인천광역시 부평구 백범로577번길 20, (십정동, 경인센타) 공장동 2층 223호",운송장비용 이차전지 제조업 외 1 종
811,(주)코리아하이테크,인천광역시 부평구 청천2동 422-10번지 외 1필지,액정 표시장치 제조업
812,(주)코마스지점,인천광역시 부평구 평천로141번길 16(청천동) 외 1필지,그 외 기타 일반목적용 기계 제조업 외 1 종
813,(주)코스앤피플,"인천광역시 부평구 안남로 414, 3층, 4층(청천동)",화장품 제조업
814,(주)코스티모,인천광역시 부평구 부평북로 244 (청천동),주방용 전기기기 제조업 외 6 종
815,(주)코썸사이언스,"인천광역시 부평구 부평대로 283, (청천동, 부평우림라이온스밸리) C동 12층 1203-B호",전자 응용 절삭기계 제조업
816,(주)코썸사이언스,"인천광역시 부평구 부평대로 283, (청천동, 부평우림라이온스밸리) C동 B1층 B101호",전자 응용 절삭기계 제조업
817,(주)코어텍,"인천광역시 부평구 주부토로 236,(갈산동, 인천테크노밸리 U1센터) 제비동 6층 619호",배전반 및 전기 자동제어반 제조업
818,(주)코엠테크,"인천광역시 부평구 평천로115번길 25, 1층 (청천동)",기타 1차 비철금속 제조업
819,(주)큐원,"인천광역시 부평구 부평대로 283, (청천동, 부평우림라이온스밸리) C동 B2층 B234호",그 외 기타 일반목적용 기계 제조업
820,(주)크린에이드,인천광역시 부평구 안남로 404 (청천동) 3층,기타 직물제품 제조업
821,(주)큰기술,"인천광역시 부평구 부평대로 283, C동 9층 911 (청천동, 부평 우림라이온스밸리)",메모리용 전자집적회로 제조업 외 1 종
822,(주)큰비젼,"인천광역시 부평구 부평대로 283,(청천동, 부평우림라이온스밸리) C동 8층 808호",비주거용 건물 임대업
823,(주)큰비젼,"인천광역시 부평구 평천로255번길 13, 8층 804호(청천동) 8층 804호",기기용 자동측정 및 제어장치 제조업 외 1 종
824,(주)클락,"인천광역시 부평구 부평대로 301 5층 515호 (청천동, 남광센트렉스) 5층 515호",기타 주변기기 제조업
825,(주)클리어윈,"인천광역시 부평구 부평대로 337, 6층 640호 (청천동, 부평 제이타워3차 지식산업센터) 6층 640호",그 외 기타 전기장비 제조업
826,(주)키움,"인천광역시 부평구 부평대로 293, 12층 1214호 (청천동, 부평테크시티) 12층 1214호",교과서 및 학습서적 출판업
827,(주)타이드,인천광역시 부평구 안남로402번길 11 (청천동),기타 전기 변환장치 제조업 외 1 종
828,(주)태광이엔이,"인천광역시 부평구 부평대로 283, (청천동, 부평우림라이온스밸리) C동 B1층 B111호",가정용 및 산업용 공기 조화장치 제조업 외 2 종
