연번,회사명,공장대표주소,업종
1, 비아이유에스,"인천광역시 부평구 부평대로 283, (청천동, 부평우림라이온스밸리) B동 5층 510호",기타 구조용 금속제품 제조업
2,(사)대한산업안전협회,"인천광역시 부평구 부평대로 301 8층 816호 (청천동, 남광센트렉스) 8층 816호 외 1필지",기타 엔지니어링 서비스업
3,(사)한국척수장애인협회 피복사업소,"인천광역시 부평구 마장로426번길 33, 301호(청천동)",가죽의복 제조업 외 14 종
4,(유)애드게이트,"인천광역시 부평구 충선로 102,  2층 (부개동)",간판 및 광고물 제조업 외 8 종
5,(유)웰스코리아,"인천광역시 부평구 주부토로 236, 제비동 b117호(갈산동) 제비동 b117호",그 외 기타 의료용 기기 제조업
6,(유)유지피디자인,"인천광역시 부평구 부평대로 283, (청천동, 부평우림라이온스밸리) C동 7층 701호",기타 엔지니어링 서비스업
7,(주)3R GLOBAL,"인천광역시 부평구 새벌로 14, 424-13 (청천동)",비디오 및 기타 영상기기 제조업 외 1 종
8,(주)JCG(제이씨지),"인천광역시 부평구 부평대로 337, 7층 740호(청천동, 부평 제이타워3차 지식산업센터) 7층 740호",그 외 기타 특수목적용 기계 제조업
9,(주)SIMPAC,인천광역시 부평구 부평북로 127 (청천동) 외 2필지,디지털 적층 성형기계 제조업 외 1 종
10,(주)SRC,"인천광역시 부평구 부평대로 283, (청천동, 부평우림라이온스밸리) A동 5층 508-B호",빵류 제조업
11,(주)가온테크놀로지,인천광역시 부평구 안남로434번길 57 (청천동) 5층,자동차용 신품 전기장치 제조업
12,(주)가쯔,"인천광역시 부평구 부평대로 301, 7층 701호(청천동, 남광센트렉스) 7층 701호",제품 디자인업
13,(주)강남밥상,"인천광역시 부평구 부평대로 337, 9층 937호 (청천동, 부평 제이타워3차 지식산업센터) 9층 937호","수산동물 훈제, 조리 및 유사 조제식품 제조업"
14,(주)강남제어시스템,"인천광역시 부평구 부평대로 283, (청천동, 부평우림라이온스밸리) C동 B2층 B235호 외 3필지",전자부품 실장기판 제조업 외 1 종
15,(주)거궁,"인천광역시 부평구 안남로 404, 2층 (청천동)",일반용 전기 조명장치 제조업
16,(주)거림씨앤에프,"인천광역시 부평구 부평대로 283, C동 10층 1010 (청천동, 부평 우림라이온스밸리) C동 10층 1010호",그 외 기타 봉제의복 제조업 외 1 종
17,(주)거림트렌드,"인천광역시 부평구 부평대로 283, (청천동, 부평우림라이온스밸리) C동 10층 1009호","근무복, 작업복 및 유사의복 제조업 외 2 종"
18,(주)건우테크,"인천광역시 부평구 부평북로 244, C동 (청천동, (주)코스티모)",그 외 금속 압형제품 제조업 외 1 종
19,(주)경기일렉트로닉,인천광역시 부평구 동수천로 86-12 (부개동),방송장비 제조업 외 1 종
20,(주)경도시스템,인천광역시 부평구 세월천로 227 (청천동),자동차용 금속 압형제품 제조업 외 1 종
21,(주)경원씨앤에스,"인천광역시 부평구 장제로 53, 3층 (부평동)",방송장비 제조업 외 1 종
22,(주)경인씨엔에스,"인천광역시 부평구 부평대로 337, 9층 921호 (청천동, 부평 제이타워3차 지식산업센터) 9층 921호 외 1필지",비주거용 건물 임대업
23,(주)경창,"인천광역시 부평구 백범로578번길 65,  도금단지 1층 101호 (십정동)",도금업
24,(주)계백미트 농업회사법인,"인천광역시 부평구 부평대로 301, 2층 215호 (청천동, 남광센트렉스) 2층 215호",육류 기타 가공 및 저장처리업 (가금류 제외) 외 1 종
25,(주)계양전력,"인천광역시 부평구 부평대로 337, 9층 907호(청천동, 부평 제이타워3차 지식산업센터) 9층 907호",배전반 및 전기 자동제어반 제조업
26,(주)공주방,인천광역시 부평구 부평북로 45-11 (청천동),커튼 및 유사제품 제조업
27,(주)광승특수인쇄,"인천광역시 부평구 부평북로 3, 2층 (청천동)",기타 인쇄업
28,(주)광안정밀,"인천광역시 부평구 부평대로 337, 1층 117호 (청천동, 부평 제이타워3차 지식산업센터) 1층 117호",주형 및 금형 제조업
29,(주)국제프린텍,인천광역시 부평구 일신로 71 (일신동),스크린 인쇄업
30,(주)굿닥터스,"인천광역시 부평구 부평대로 283, (청천동, 부평우림라이온스밸리) B동 2층 208호",치과용 기기 제조업
31,(주)귀뚜라미,인천광역시 부평구 백범로603번길 19 (십정동),비주거용 건물 임대업
32,(주)그래이츠,인천광역시 부평구 주부토로 236(갈산동) B동 4층 417호,육류 포장육 및 냉동육 가공업 (가금류 제외)
33,(주)그렌텍,"인천광역시 부평구 부평대로297번길 28, 1층, 지하 (청천동)",기타 가정용 전기기기 제조업
34,(주)그루크리에이티브랩,"인천광역시 부평구 부평대로 293, 10층 1013호 (청천동, 부평테크시티) 10층 1013호",기타 게임 소프트웨어 개발 및 공급업
35,(주)그린텍코리아,"인천광역시 부평구 새벌로 44, B동 2층(청천동)",그 외 기타 종이 및 판지 제품 제조업 외 1 종
36,(주)글로벌엘이디,"인천광역시 부평구 평천로199번길 53, A-1-1 (청천동)",일반용 전기 조명장치 제조업
37,(주)금동이,"인천광역시 부평구 항동로125번길 7, A동 2층 (일신동)",수산식물 가공 및 저장 처리업
38,(주)금산,"인천광역시 부평구 백범로577번길 20, 공장동동 4층 412호 (십정동, 경인센타) 공장동 4층 412호",방송장비 제조업 외 1 종
39,(주)금우바이오틱스,"인천광역시 부평구 부평대로 293, 8층 811호 (청천동, 부평테크시티) 8층 811호",생물 살균.살충제 및 식물보호제 제조업 외 4 종
40,(주)기간산업,"인천광역시 부평구 부평대로 283, (청천동, 부평우림라이온스밸리) A동 5층 502-B호",간판 및 광고물 제조업
41,(주)깅코우,인천광역시 부평구 부평대로313번길 18 (청천동),남자용 겉옷 제조업
42,(주)나다텔 부평공장,"인천광역시 부평구 안남로402번길 15, 4층 (청천동)",방송장비 제조업
43,(주)나라이엔씨,"인천광역시 부평구 부평대로 301, 8층 802호(청천동, 남광센트렉스) 8층 802호",비주거용 건물 임대업
44,(주)나우정보,"인천광역시 부평구 부평대로 337, 12층 1246호(청천동, 부평 제이타워3차 지식산업센터) 12층 1246호",시스템 소프트웨어 개발 및 공급업
45,(주)나인텍,"인천광역시 부평구 부평대로 283, (청천동, 부평우림라이온스밸리) B동 B2층 B224호 외 1필지",이동전화기 제조업 외 1 종
46,(주)남도애꽃,인천광역시 부평구 가재울로 163 (십정동),육류 기타 가공 및 저장처리업 (가금류 제외) 외 4 종
47,(주)남일광학기기,"인천광역시 부평구 부평대로 283, (청천동, 부평우림라이온스밸리) C동 4층 410-B호 외 1필지",기타 광학기기 및 사진기 제조업
48,(주)낼바이오,"인천광역시 부평구 새벌로 4, 301호 (청천동)",가정용 전기 난방기기 제조업
49,(주)네모엘텍,"인천광역시 부평구 백범로577번길 20, 공장동동 7층 721호 (십정동) 공장동 7층 721호",전구 및 램프 제조업 외 1 종
50,(주)네오시스,"인천광역시 부평구 부평대로 337, 5층 501호(청천동, 부평 제이타워3차 지식산업센터) 5층 501호 외 6필지",체외 진단 시약 제조업 외 1 종
51,(주)넥스원이노베이션 ,"인천광역시 부평구 안남로433번길 19, (주)넥스원이노베이션 (청천동)",그 외 기타 전자부품 제조업
52,(주)넥스텍케미칼,"인천광역시 부평구 부평대로 301, 7층 706호 (청천동, 남광센트렉스) 7층 706호",기타 공학 연구개발업
53,(주)노마지,"인천광역시 부평구 무네미로448번길 56, 산학협력관 306호(구산동, 한국폴리텍대학(인천캠퍼스))",그 외 기타 분류 안된 화학제품 제조업 외 1 종
54,(주)녹기통신,"인천광역시 부평구 부평대로 283, (청천동, 부평우림라이온스밸리) A동 5층 508호",비주거용 건물 임대업
55,(주)누리메딕스,"인천광역시 부평구 부평대로 337, 5층 509호(청천동, 부평 제이타워3차 지식산업센터) 5층 509호 외 1필지",체외 진단 시약 제조업 외 1 종
56,(주)누리에프앤씨,"인천광역시 부평구 안남로418번길 10, 3층(청천동)",그 외 기타 봉제의복 제조업 외 9 종
57,(주)뉴매콘시스템,"인천광역시 부평구 부평대로 301 6층 622호 (청천동, 남광센트렉스) 6층 622호",컨베이어장치 제조업 외 1 종
58,(주)뉴스텍컴퍼니,"인천광역시 부평구 마장로432번길 34, 2층(청천동, 뉴스텍 컴퍼니)",전기회로 접속장치 제조업
59,(주)뉴컨,"인천광역시 부평구 부평대로 283,(일부) (청천동, 부평우림라이온스밸리) B동 5층 506호",데이터베이스 및 온라인정보 제공업 외 2 종
60,(주)닉스테크,"인천광역시 부평구 청천마차로 196, 4층 (청천동)",일반용 전기 조명장치 제조업
61,(주)다돌,"인천광역시 부평구 부평대로 337, 8층 838호(청천동, 부평 제이타워3차 지식산업센터) 8층 838호",그 외 기타 플라스틱 제품 제조업 외 3 종
62,(주)다모아캠,"인천광역시 부평구 부평대로 283, C동 4층 402 (청천동, 부평 우림라이온스밸리)",기타 광학기기 및 사진기 제조업
63,(주)다모텍,"인천광역시 부평구 평천로199번길 34, 3층 F호 (청천동)",일반용 전기 조명장치 제조업 외 1 종
64,(주)다온에이치씨,인천광역시 부평구 안남로434번길 55 (청천동),일반용 전기 조명장치 제조업 외 1 종
65,(주)다올씨앤씨,"인천광역시 부평구 부평대로 301, 3층 303호 (청천동, 남광센트렉스) 3층 303호",방송장비 제조업 외 3 종
66,(주)다올씨앤씨,"인천광역시 부평구 부평대로 301 5층 520호 (청천동, 남광센트렉스) 5층 520호",방송장비 제조업 외 3 종
67,(주)다원정밀,인천광역시 부평구 청천마차로 86 (청천동),전동기 및 발전기 제조업 외 2 종
68,(주)다이즈하이미디어,"인천광역시 부평구 백범로577번길 20, (십정동, 경인센타) 공장동 7층 724호",전시 및 광고용 조명장치 제조업 외 3 종
69,(주)다인,"인천광역시 부평구 청천마차로 20, 1층(청천동)",그 외 기타 플라스틱 제품 제조업 외 4 종
70,(주)다진테크,"인천광역시 부평구 부평대로 283,(청천동, 부평우림라이온스밸리) C동 11층 1110-C호",전시용 모형 제조업 외 1 종
71,(주)다폼,"인천광역시 부평구 부평대로 293 11층 1108호 (청천동, 부평테크시티) 11층 1108호",호스팅 및 관련 서비스업 외 2 종
72,(주)닥터큐,"인천광역시 부평구 부평대로 337 4층 420호 (청천동, 부평 제이타워3차 지식산업센터) 4층 420호 외 2필지",자동차 재제조 부품 제조업
73,(주)달리팩,"인천광역시 부평구 부평북로 245, 1, 2, 5층(청천동, 레드런)",포장용 플라스틱 성형용기 제조업
74,(주)닷,"인천광역시 부평구 부평대로 283, (청천동, 부평우림라이온스밸리) A동 3층 301호 외 1필지",그 외 기타 전자부품 제조업 외 1 종
75,(주)대경에프엔티 지점,"인천광역시 부평구 백범로577번길 20, 경인센타 (십정동) 외 1필지",침구 및 관련제품 제조업
76,(주)대륜이엔지,인천광역시 부평구 부평북로 373 (삼산동),기타 가공 공작기계 제조업
77,(주)대명크렌시아,"인천광역시 부평구 부평북로 328, (주)대명크렌시아 (갈산동)",매트리스 및 침대 제조업
78,(주)대성스크린,"인천광역시 부평구 부평대로329번길 46 (청천동, 펌텍코리아(주))",스크린 인쇄업
79,(주)대성스크린,인천광역시 부평구 평천로53번길 24 (청천동),스크린 인쇄업
80,(주)대성종합주방물류,인천광역시 부평구 서달로298번길 123 (청천동),금속 위생용품 제조업
81,(주)대신건업,인천광역시 부평구 항동로46번길 38 (일신동),"금속 문, 창, 셔터 및 관련제품 제조업"
82,(주)대원에프에이,"인천광역시 부평구 부평대로 283, (청천동, 부평우림라이온스밸리) B동 8층 808-B호",기기용 자동측정 및 제어장치 제조업
83,(주)대원화인켐,"인천광역시 부평구 부평대로 337, 6층 638호 (청천동, 부평 제이타워3차 지식산업센터) 6층 638호",포장 및 충전업
84,(주)대은글로벌솔루션,"인천광역시 부평구 부평대로 283, (청천동, 부평우림라이온스밸리) B동 6층 603-C호 외 1필지",구름베어링 제조업 외 6 종
85,(주)대일본초,"인천광역시 부평구 부평대로 337, 3층 328호(청천동, 부평 제이타워3차 지식산업센터) 3층 328호",광고 대행업
86,(주)대진표면처리약품,인천광역시 부평구 십정동 120번지 경남도금단지 401호,그 외 기타 분류 안된 화학제품 제조업 외 2 종
87,(주)대평종합운수,"인천광역시 부평구 부평대로 337, 10층 1038호 (청천동, 부평 제이타워3차 지식산업센터) 10층 1038호",포장 및 충전업
88,(주)대한비즈플랫폼,"인천광역시 부평구 부평대로 337, 9층 937호 (청천동, 부평 제이타워3차 지식산업센터) 9층 937호",통신 재판매업
89,(주)대현에이엔디(지점),"인천광역시 부평구 부평대로 337, 2층 207호(청천동, 부평 제이타워3차 지식산업센터) 2층 207호",인테리어 디자인업
90,(주)대호국제물류,"인천광역시 부평구 부평대로 337, 11층 1127호(청천동, 부평 제이타워3차 지식산업센터) 11층 1127호",경영 컨설팅업
91,(주)대흥밸브,"인천광역시 부평구 평천로255번길 13, 5층 501호  (청천동) 5층 501호 외 3필지","탭, 밸브 및 유사장치 제조업"
92,(주)대흥인터내셔날,"인천광역시 부평구 부평대로 301 5층 508-2호 (청천동, 남광센트렉스) 5층 508-2호",기타 절연선 및 케이블 제조업
93,(주)더마크엠,인천광역시 부평구 새벌로 4(청천동),기타 부동산 개발 및 공급업
94,(주)더메이테크,"인천광역시 부평구 부평대로 283, (청천동, 부평우림라이온스밸리) C동 6층 609-B호",비디오 및 기타 영상기기 제조업 외 13 종
95,(주)더블유엠비,"인천광역시 부평구 부평대로 337, 6층 623호 (청천동, 부평 제이타워3차 지식산업센터) 6층 623호","광고물 문안, 도안, 설계 등 작성업 외 1 종"
96,(주)더블유티씨,"인천광역시 부평구 무네미로448번길 56, 421호(구산동, 한국폴리텍대학(인천캠퍼스))",방송장비 제조업 외 3 종
97,(주)더비씨,"인천광역시 부평구 부평대로 301 8층 818-2호 (청천동, 남광센트렉스) 8층 818-2호","기타 기술 시험, 검사 및 분석업 외 1 종"
98,(주)더플러스엔지니어링,"인천광역시 부평구 부평대로 283, (청천동, 부평우림라이온스밸리) C동 11층 1103-B호",건축설계 및 관련 서비스업
99,(주)덕성그린텍,"인천광역시 부평구 부평대로 283, (청천동, 부평우림라이온스밸리) C동 12층 1201호",기체 여과기 제조업 외 2 종
100,(주)데브언리밋,"인천광역시 부평구 부평대로 293, 9층 907호 (청천동, 부평테크시티) 9층 907호",응용 소프트웨어 개발 및 공급업
101,(주)데이터하이브,"인천광역시 부평구 부평대로 293, 9층 913호 (청천동, 부평테크시티) 9층 913호",데이터베이스 및 온라인정보 제공업 외 2 종
102,(주)데이터하이브,"인천광역시 부평구 부평대로 293, 9층 913호 (청천동, 부평테크시티) 9층 913호",데이터베이스 및 온라인정보 제공업 외 2 종
103,(주)데코원,인천광역시 부평구 평천로 205 (청천동) 외 1필지,침구 및 관련제품 제조업 외 1 종
104,(주)도움다리,인천광역시 부평구 주부토로 279 (갈산동),그 외 기타 달리 분류되지 않은 제품 제조업 외 1 종
105,(주)도원에이치,인천광역시 부평구 부평대로313번길 84 (청천동),기타 직물제품 제조업
106,(주)동곡,인천광역시 부평구 부평대로313번길 84 (청천동) 2층 1호,침구 및 관련제품 제조업 외 15 종
107,(주)동명양행,인천광역시 부평구 부평대로313번길 18 (청천동) 2층,"근무복, 작업복 및 유사의복 제조업 외 7 종"
108,(주)동명엔지니어링,인천광역시 부평구 부평북로 5(청천동),그 외 기타 일반목적용 기계 제조업 외 1 종
109,(주)동아에스티씨,"인천광역시 부평구 가재울로 129 (십정동, 테크노1공장)",그 외 기타 특수목적용 기계 제조업 외 1 종
110,(주)동아에프이,"인천광역시 부평구 경인로1083번길 62, 2층 (부개동)",배전반 및 전기 자동제어반 제조업
111,(주)동아에프이,"인천광역시 부평구 부평대로 283,(청천동, 부평우림라이온스밸리) B동 5층 503-B호",전기회로 접속장치 제조업 외 1 종
112,(주)동양테크놀로지,"인천광역시 부평구 부평대로 283, B동 B104, C동 B131호 (청천동, 부평 우림라이온스밸리)",가정용 및 산업용 공기 조화장치 제조업 외 14 종
113,(주)동양후로아,"인천광역시 부평구 부평북로 363, A동 7호 (삼산동)",합성수지 및 기타 플라스틱 물질 제조업 외 1 종
114,(주)동와,인천광역시 부평구 안남로433번길 8 (청천동),기타 운동 및 경기용구 제조업
115,(주)동우전자,"인천광역시 부평구 부평대로 283, (청천동, 부평우림라이온스밸리) C동 4층 403호 외 4필지",전자부품 실장기판 제조업
116,(주)동원롤,인천광역시 부평구 부평북로 379 (삼산동),그 외 기타 특수목적용 기계 제조업 외 2 종
117,(주)동익엔지니어링,인천광역시 부평구 평천로255번길 13 3층 303호  (청천동) 3층 303호,배전반 및 전기 자동제어반 제조업
118,(주)동진실리콘,"인천광역시 부평구 새벌로 29 5층 501호 (청천동, 부평테크노타워) 5층 501호",그 외 기타 고무제품 제조업
119,(주)두리엔터프라이즈,"인천광역시 부평구 백범로577번길 15 -13(십정동, 공장)",그 외 자동차용 신품 부품 제조업 외 4 종
120,(주)두영에프앤디,"인천광역시 부평구 경인로 1123,  1층 동관 (일신동)",육류 기타 가공 및 저장처리업 (가금류 제외) 외 1 종
121,(주)두진금형,인천광역시 부평구 장제로329번길 44 (갈산동),주형 및 금형 제조업
122,(주)두현인텍,인천광역시 부평구 안남로402번길 48(청천동),기타 기계.장비 조립용 플라스틱 제품 제조업 외 2 종
123,(주)둘로스기업,인천광역시 부평구 안남로402번길 15 (청천동),그 외 기타 분류 안된 금속 가공 제품 제조업 외 3 종
124,(주)듀델코리아,"인천광역시 부평구 부평대로 337, 2층 214호 (청천동, 부평 제이타워3차 지식산업센터) 2층 214호",사업시설 유지.관리 서비스업
125,(주)듀센 코리아,"인천광역시 부평구 부평대로 293 11층 1109호 (청천동, 부평테크시티) 11층 1109호",기타 엔지니어링 서비스업
126,(주)듀센코리아,"인천광역시 부평구 새벌로 9, 3~4층 (청천동)",이동전화기 제조업 외 6 종
127,(주)듀센코리아,인천광역시 부평구 부평대로297번길 73 (청천동),이동전화기 제조업 외 5 종
128,(주)듀오카,"인천광역시 부평구 부평대로 337, 10층 1027호 (청천동, 부평 제이타워3차 지식산업센터) 10층 1027호 외 1필지",데이터베이스 및 온라인정보 제공업 외 2 종
129,(주)드림인,"인천광역시 부평구 안남로369번길 30, 3층 3-7호(청천동)",가방 및 기타 보호용 케이스 제조업
130,(주)드림테크이엔씨,"인천광역시 부평구 부평대로 283, A동 7층 712 (청천동, 부평 우림라이온스밸리)","전기회로 개폐, 보호장치 제조업 외 2 종"
131,(주)드림퍼니쳐,인천광역시 부평구 부평북로 183-1 (청천동),기타 목재가구 제조업
132,(주)드웰링,"인천광역시 부평구 부평대로 283, C동 8층 803호 (청천동, 부평 우림라이온스밸리)","물질 검사, 측정 및 분석기구 제조업 외 1 종"
133,(주)디뷰파트너스 (D-View Partners),인천광역시 부평구 가재울로 163 (십정동),커튼 및 유사제품 제조업
134,(주)디브이알씨앤씨,"인천광역시 부평구 부평대로 301 4층 418호 (청천동, 남광센트렉스) 4층 418호",방송장비 제조업 외 5 종
135,(주)디스텍,인천광역시 부평구 주부토로262번길 30 (갈산동),유선 통신장비 제조업 외 2 종
136,(주)디스텍,"인천광역시 부평구 평천로199번길 53, C동 3층 (청천동)",기타 음향기기 제조업
137,(주)디스플레이비투비,"인천광역시 부평구 부평대로 301, 3층 303호 (청천동, 남광센트렉스) 3층 303호",컴퓨터 모니터 제조업 외 3 종
138,(주)디앤디우니코(D&D UNICO Co.Ltd),인천광역시 부평구 평천로199번길 53 (청천동),가방 및 기타 보호용 케이스 제조업
139,(주)디앤시스,"인천광역시 부평구 무네미로448번길 56, 하이테크관307호 (구산동, 폴리텍Ⅱ대학)",컴퓨터 제조업
140,(주)디앤시스,인천광역시 부평구 부평대로297번길 34 (청천동),컴퓨터 제조업
141,(주)디앤시스,"인천광역시 부평구 부평대로 337, 7층 745호 (청천동, 부평 제이타워3차 지식산업센터) 7층 745호",컴퓨터 제조업
142,(주)디앤시스,인천광역시 부평구 새벌로 15 (청천동),컴퓨터 제조업
143,(주)디앤피파크,"인천광역시 부평구 부평대로 301 9층 925호 (청천동, 남광센트렉스) 9층 925호 외 7필지",그 외 기타 전자부품 제조업 외 1 종
144,(주)디에스이엔지,인천광역시 부평구 청천마차로 250 (청천동),일반철물 제조업 외 4 종
145,(주)디에스이엔지,"인천광역시 부평구 부평대로 337, 12층 1217호 (청천동, 부평 제이타워3차 지식산업센터) 12층 1217호",기타 엔지니어링 서비스업
146,(주)디에이텍,"인천광역시 부평구 부평대로 283, (청천동, 부평우림라이온스밸리) C동 7층 710호",전기경보 및 신호장치 제조업 외 1 종
147,(주)디에프코리아,"인천광역시 부평구 평천로199번길 53, A동 2층 (청천동)",전구 및 램프 제조업 외 1 종
148,(주)디엔테크,"인천광역시 부평구 부평대로297번길 96, 4층(청천동)",치과용 기기 제조업
149,(주)디와이,"인천광역시 부평구 장제로 170, 지하1층 (부평동, 금호레스빌)",문구용 종이제품 제조업
150,(주)디자인시스템,"인천광역시 부평구 부평대로 337, 7층 720호(청천동, 부평 제이타워3차 지식산업센터) 7층 720호 외 2필지",일반용 전기 조명장치 제조업 외 1 종
151,(주)디저트앤,인천광역시 부평구 부평대로313번길 18 (청천동) 3층,빵류 제조업
152,(주)디저트앤 부평지점,"인천광역시 부평구 부평대로 337, 7층 746호(청천동, 부평 제이타워3차 지식산업센터) 7층 746호",빵류 제조업
153,(주)디지탈웍스,"인천광역시 부평구 부평대로 283, C동 2층 206 (청천동, 부평 우림라이온스밸리)",배전반 및 전기 자동제어반 제조업
154,(주)디지탈웨어,"인천광역시 부평구 부평대로 283, C동 9층 909 (청천동, 부평 우림라이온스밸리)",비디오 및 기타 영상기기 제조업 외 4 종
155,(주)디케이엔지,"인천광역시 부평구 부평대로 283, (청천동, 부평우림라이온스밸리) A동 5층 509호 외 1필지",산업처리공정 제어장비 제조업 외 3 종
156,(주)디케이엔지 ,"인천광역시 부평구 부평대로 293, 7층 705호(청천동, 부평테크시티) 7층 705호",기타 엔지니어링 서비스업
157,(주)디케이이노매틱,"인천광역시 부평구 부평대로 283, (청천동, 부평우림라이온스밸리) B동 2층 202-B호",산업처리공정 제어장비 제조업 외 2 종
158,(주)디케이티,인천광역시 부평구 평천로199번길 13 (청천동),경성 인쇄회로기판 제조업
159,(주)디케이티,인천광역시 부평구 평천로199번길 25 (청천동),경성 인쇄회로기판 제조업
160,(주)디티에스아이엔씨,인천광역시 부평구 일신로39번길 16-17 (일신동),안경 및 안경렌즈 제조업
161,(주)디파트라이트,"인천광역시 부평구 부평대로 301 7층 713호 (청천동, 남광센트렉스) 7층 713호 외 1필지",일반용 전기 조명장치 제조업 외 3 종
162,(주)라이징크래프트,"인천광역시 부평구 부평대로 293, 9층 906호 (청천동, 부평테크시티) 9층 906호",유선 온라인 게임 소프트웨어 개발 및 공급업 외 2 종
163,(주)라이프디엔에이,"인천광역시 부평구 백범로577번길 20, (십정동, 경인센타) 공장동 6층 635호",기타 식품 첨가물 제조업
164,(주)라피네르,"인천광역시 부평구 평천로 213 (청천동) 생산동 1층, 3층",표면광택제 및 실내가향제 제조업
